,Company Name,Company Code
1593,"WG Tech (JiangXi) Group Co., LTD.",603773
1594,603776,603776
1595,"Shanghai Laiyifen Co., Ltd.",603777
1596,"Guosheng Shian Technology Co., Ltd.",603778
1597,"WEILONG GRAPE WINE CO., LTD.",603779
1598,"KEBODA TECHNOLOGY CO., LTD.",603786
1599,"JIANGSU XINRI E-VEHICLE CO., LTD.",603787
1600,Ningbo Gaofa Automotive Control System Co. LTD,603788
1601,"ARGUS (SHANGHAI) TEXTILE CHEMICALS CO.,LTD.",603790
1602,"Guangdong Liantai Environmental Protection Co.,Ltd.",603797
1603,QINGDAO COPTON TECHNOLOGY COMPANY LIMITED,603798
1604,"ZHEJIANG HUAYOU COBALT CO., LTD.",603799
1605,"Jiangsu Hongtian Technology Co.,Ltd.",603800
1606,"ZBOM HOME COLLECTION CO.,LTD",603801
1607,"RAISECOM TECHNOLOGY CO.,Ltd.",603803
1608,"HANGZHOU FIRST APPLIED MATERIAL CO., LTD.",603806
1609,"Shenzhen Ellassay Fashion Co.,Ltd.",603808
1610,"CHENGDU HAONENG TECHNOLOGY CO., LTD.",603809
1611,"Jiangsu Fengshan Group Co., Ltd.",603810
1612,"ZHEJIANG CHENG YI PHARMACEUTICAL CO.,LTD.",603811
1613,"Anhui Gourgen Traffic Construction Co.,Ltd.",603815
1614,"Jason Furniture（Hangzhou）Co.,Ltd.",603816
1615,"Fujian Haixia Environmental Protection Group Co.,Ltd.",603817
1616,"QuMei Home Furnishings Group Co., Ltd",603818
1617,Changzhou Shenli Electrical Machine Incorporated Company,603819
1618,"LILY GROUP CO.,LTD",603823
1619,"FUJIAN KUNCAI MATERIAL TECHNOLOGY CO.,LTD",603826
1620,603829,603829
1621,Oppein Home Group Inc.,603833
1622,"Bondex Supply Chain Management Co., Ltd.",603836
1623,"Anzheng Fashion Group Co.,Ltd",603839
1624,"Guangdong Hotata Technology Group  co., Ltd.",603848
1625,603855,603855
1626,603856,603856
1627,"Shandong Buchang Pharmaceuticals Co., Ltd",603858
1628,"Nancal Technology Co.,Ltd",603859
1629,603860,603860
1630,"Guangzhou Baiyun Electric Equipment Co., Ltd.",603861
1631,"GuangDong SongYang Recycle Resources CO.,LTD",603863
1632,"Toly Bread Co., Ltd.",603866
1633,"ZHEJIANG XINHUA CHEMICAL CO.,LTD",603867
1634,"Shanghai Flyco Electrical Appliance Co., Ltd",603868
1635,"JIA YOU INTERNATIONAL LOGISTICS CO., LTD",603871
1636,"Jiangsu Dingsheng New Materials Joint-Stock Co.,Ltd",603876
1637,"Ningbo Peacebird Fashion Co., Ltd.",603877
1638,"Jiangsu Wujin Stainless Steel Pipe Group CO.,LTD.",603878
1639,"YONGYUE SCIENCE&TECHNOLOGY CO.,LTD",603879
1640,"Jiangsu Nanfang Medical Co.,Ltd.",603880
1641,"Shanghai Athub Co.,Ltd.",603881
1642,"Guangzhou Kingmed Diagnostics Group Co., Ltd.",603882
1643,LBX Pharmacy Chain Joint Stock Company,603883
1644,"JUNEYAO AIRLINES Co., Ltd",603885
1645,"Ganso Co., Ltd",603886
1646,"Shanghai CDXJ Digital Technology Co.,LTD.",603887
1647,"XINHUANETCO.,LTD.",603888
1648,Zhejiang Xinao Textiles Inc.,603889
1649,"Suzhou Chunqiu Electronic Technology Co., LTD",603890
1650,603893,603893
1651,"Shanghai Tianyong Engineering Co.,Ltd",603895
1652,"Zhejiang Shouxiangu Pharmaceutical Co., Ltd.",603896
1653,"ZHEJIANG GRANDWALL ELECTRIC SCIENCE&TECHNOLOGY CO.,LTD.",603897
1654,"Guangzhou Holike Creative Home Co.,Ltd.",603898
1655,Shanghai M&G Stationery Inc.,603899
1656,Leysen Jewellery Inc.,603900
1657,"Hangzhou Youngsun Intelligent Equipment Co., Ltd.",603901
1658,"CSD Water Service Co., Ltd.",603903
1659,"Jiangsu Lopal Tech. Group Co., Ltd.",603906
1660,"COMEFLY OUTDOOR CO.,LTD",603908
1661,"C&D Holsin Engineering Consulting Co., Ltd",603909
1662,"Nanjing Canatal Data-Centre Environmental Tech Co., Ltd",603912
1663,"JIANGSU GUOMAO REDUCER CO., LTD.",603915
1664,"SOBUTE NEW MATERIALS CO., LTD",603916
1665,"Ningbo Heli  Technology  Co., Ltd.",603917
1666,"Shanghai Golden Bridge InfoTech Co.,Ltd.",603918
1667,"JINHUI LIQUOR Co.,Ltd.",603919
1668,"OLYMPIC CIRCUIT TECHNOLOGY CO.,LTD",603920
1669,"Suzhou Jinhongshun Auto Parts Co., LTD.",603922
1670,"TIELIU CO.,LTD.",603926
1671,"Sinosoft Co.,Ltd",603927
1672,"Suzhou Xingye Materials Technology Co.,Ltd.",603928
1673,"L&K ENGINEERING(SUZHOU)CO.,LTD.",603929
1674,"HANGZHOU GREENDA ELECTRONIC MATERIALS CO.,LTD",603931
1675,"FUJIAN RAYNEN TECHNOLOGY CO.,LTD",603933
1676,"BOMIN ELECTRONICS CO., LTD.",603936
1677,"JIANGSU LIDAO NEW MATERIAL CO., LTD.",603937
1678,"Tangshan Sunfar Silicon Industries Co., Ltd",603938
1679,"Yifeng Pharmacy Chain Co., Ltd.",603939
1680,Zhejiang Jianye Chemical Co.，Ltd,603948
1681,"Xuelong Group Co.,Ltd.",603949
1682,"Xiangyang Changyuandonggu Industry Co., Ltd.",603950
1683,"DAQIAN ECOLOGY & ENVIRONMENT GROUP CO., LTD",603955
1684,"WPG (Shanghai) Smart Water Public Co.,Ltd",603956
1685,"HARSON TARDING (CHINA) CO.,LTD.",603958
1686,"HUNAN BAILI ENGINEERING SCI&TECH CO.,LTD",603959
1687,"Shanghai Kelai Mechatronics Engineering Co.,Ltd.",603960
1688,"Eurocrane (China) Co.,Ltd.",603966
1689,"CHINA MASTER LOGISTICS.,LTD.",603967
1690,"Nan  Tong  Acetic  Acid  Co.,   Ltd.",603968
1691,"Silvery Dragon Group Co.,Ltd. Tianjin",603969
1692,"SINO-AGRI  LEADING  BIOSCIENCES  CO.,LTD.",603970
1693,"ChongQing Zhengchuan Pharmaceutical Packaging Co.,Ltd.",603976
1694,"Jiangxi Guotai Group Co., Ltd.",603977
1695,"SHENZHEN SUNXING LIGHT ALLOYS MATERIALS CO.,LTD.",603978
1696,"JCHX MINING MANAGEMENT CO.,LTD.",603979
1697,"ZheJiang JiHua Group Co.,Ltd",603980
1698,"NANJING CHERVON AUTO PRECISION TECHNOLOGY CO., LTD",603982
1699,"Guangdong Marubi Biotechnology Co., Ltd",603983
1700,"Jiangyin Hengrun Heavy Industries Co.,Ltd",603985
1701,GigaDevice Semiconductor Inc.,603986
1702,"Shanghai Kindly Enterprise Development Group Co.,Ltd.",603987
1703,"SEC Electric Machinery Co., Ltd.",603988
1704,"HUNAN AIHUA GROUP C0.,LTD.",603989
1705,"Suzhou MedicalSystem Technology Co., Ltd.",603990
1706,"Shanghai Original Advanced Compounds Co., Ltd",603991
1707,"XIAMEN SOLEX HIGH-TECH INDUSTRIES CO., LTD.",603992
1708,CMOC Group Limited,603993
1709,"Yongjin Technology Group Co., Ltd",603995
1710,"Ningbo Jifeng Auto Parts Co.,Ltd.",603997
1711,"Hunan Fangsheng Pharmaceutical Co., Ltd.",603998
1712,"DuZhe Publishing&Media Co.,Ltd.",603999
1713,"Qingdao Victall Railway Co.,Ltd.",605001
1714,"ZhongWang Fabric Co., Ltd.",605003
1715,"CWB Automotive Electronics Co., Ltd.",605005
1716,605006,605006
1717,"Wuzhou Special Paper Group Co., Ltd.",605007
1718,Ningbo Changhong Polymer Scientific & Technical Inc.,605008
1719,"Hangzhou Haoyue Personal Care Co., Ltd",605009
1720,605011,605011
1721,"SHANDONG BAILONG CHUANGYUAN BIO-TECH CO.,LTD.",605016
1722,"Changhua Holding Group Co., Ltd.",605018
1723,"Zhejiang Yonghe Refrigerant Co., Ltd.",605020
1724,"NINGBO SHIMAO ENERGY CO.,LTD",605028
1725,"Shaanxi Meibang Pharmaceutical Group Co., Ltd.",605033
1726,"Friend Co., Ltd.",605050
1727,"Zhejiang Yingfeng Technology Co.,Ltd.",605055
1728,"Xianheng Internatioal Science&Technology Co.,Ltd.",605056
1729,"No.15 Xinke Road,Xinbei District,Changzhou, Jiangsu",605058
1730,"Allied Machinery Co., Ltd.",605060
1731,Zhejiang Tengen Electrics Co.Ltd,605066
1732,"Mingxin New Material Co.,Ltd.",605068
1733,"Beijing ZEHO Waterfront Ecological Environment Treatment Co.,Ltd.",605069
1734,"ZHEJIANG HUAKANG PHARMACEUTICAL CO.,LTD.",605077
1735,"ZHEJIANG NATURAL OUTDOOR GOODS INC.,LTD",605080
1736,"LONGYAN KAOLIN CLAY CO., LTD.",605086
1737,"GSP AUTOMOTIVE GROUP WENZHOU CO., LTD.",605088
1738,"SUZHOU WEIZHIXIANG FOOD CO., LTD.",605089
1739,"Jiangxi Jovo Energy Co., Ltd.",605090
1740,"Shanghai Action Education Technology CO., LTD.",605098
1741,"Co Creation Grass Co.,Ltd.",605099
1742,"Power HF Co., Ltd.",605100
1743,TongQingLou Catering Corporation Limited.,605108
1744,605111,605111
1745,"Aurisco Pharmaceutical Co.,Ltd",605116
1746,"Ningbo Deye Technology Co., Ltd.",605117
1747,"Xiamen Leading Optics Co., Ltd.",605118
1748,"CHONGQING SIFANG NEW MATERIAL CO., LTD.",605122
1749,"Wuxi Paike New Materials Technology Co.,Ltd.",605123
1750,"Shanghai Yanpu Precision Technology(Group) Co.,Ltd",605128
1751,"Jiangsu Rongtai Industry Co.,Ltd.",605133
1752,"Shanghai Lily&Beauty Cosmetics Co., Ltd.",605136
1753,605138,605138
1754,"West Shanghai Automotive Service Co.,Ltd.",605151
1755,ZHEJIANG XIDAMEN NEW MATERIAL CO.，LTD,605155
1756,"Zhejiang Huada New Materials Co., Ltd.",605158
1757,"Zhejiang Xinzhonggang Thermal Power Co., Ltd.",605162
1758,"Juheshun Advanced Material Co.,Ltd.",605166
1759,Jiangsu Libert INC.,605167
1760,"Three’s Company Media Group Co., Ltd.",605168
1761,"Xinjiang Hongtong Natural Gas Co., Ltd.",605169
1762,"Zhejiang East-Asia Pharmaceutical Co., Ltd",605177
1763,"Beijing New Space Technology Co., Ltd.",605178
1764,"Zhejiang Yiming Food Co., Ltd.",605179
1765,"ZHEJIANG HUASHENG TECHNOLOGY CO.,LTD",605180
1766,"Quechen Silicon Chemical Co., Ltd.",605183
1767,"Shanghai General Healthy Information and Technology Co., Ltd.",605186
1768,"JIANGXI GUOGUANG COMMERCIAL CHAINS CO.,LTD.",605188
1769,"Wuhu Fuchun Dye and Weave Co.,Ltd",605189
1770,"Hebei Huatong Wires and Cables Group Co., Ltd.",605196
1771,"Yantai North Andre Juice Co., Ltd.",605198
1772,"ShangHai Yongmaotai Automotive Technology Co.,Ltd",605208
1773,"Ways Electron Co., Ltd.",605218
1774,"Shanghai Qifan Cable Co., Ltd",605222
1775,"SHENTONG TECHNOLOGY GROUP CO.,LTD",605228
1776,"NINGBO TIP RUBBER TECHNOLOGY CO.,LTD",605255
1777,"Jiangsu  Xiehe Electronic Co.,Ltd",605258
1778,605259,605259
1779,605266,605266
1780,"Wangli Security & Surveillance Product Co., Ltd",605268
1781,"Xinya Electronic Co.,Ltd",605277
1782,"Jiangsu Tongli Tianqi Technology Co., Ltd.",605286
1783,"Decai Decoration CO.,LTD",605287
1784,Changzhou Kaidi Electrical Inc..,605288
1785,Shanghai Luoman Technologies Inc.,605289
1786,"Yunnan Shennong Agricultural Industry Group Co.,LTD.",605296
1787,"Jiangsu Bide Science and Technology Co., Ltd.",605298
1788,"Shuhua Sports Co., Ltd.",605299
1789,"Jiahe Foods Industry Co., Ltd.",605300
1790,"Hangzhou Landscaping Co.,Ltd.",605303
1791,3S Industry Group INC.,605305
1792,605318,605318
1793,"Wuxi Zhenhua Auto Parts Co., Ltd",605319
1794,"Kunshan Huguang Auto Harness Co., Ltd.",605333
1795,"ZHEJIANG SANFER ELECTRIC CO.,LTD",605336
1796,"ZHE JIANG LI ZI YUAN FOOD CO,LTD",605337
1797,"Zhongyin Babi Food Co.,Ltd.",605338
1798,"Namchow Food Group（Shanghai) Co., Ltd.",605339
1799,"Hangzhou Lion Microelectronics Co.,Ltd.",605358
1800,Leedarson IoT Technology Inc.,605365
1801,"Jiangxi Hungpai New Material Technology Co.,Ltd.",605366
1802,"Henan Lantian Gas Co.,Ltd.",605368
1803,"Zhejiang Gongdong Medical Technology Co., Ltd.",605369
1804,"Jiangsu Boqian New Materials Stock Co., Ltd.",605376
1805,"Hangzhou Huawang New Material Technology Co., Ltd.",605377
1806,"Zhejiang Mustang Battery Co.,Ltd",605378
1807,"Juneyao Grand Healthy Drinks Co.,Ltd.",605388
1808,"JiangSu Changling Hydraulic Co., Ltd",605389
1809,"Shanghai New Centurion Network Information Technology Co., Ltd.",605398
1810,"Jiang Xi Chenguang New Materials Co.,Limited.",605399
1811,605488,605488
1812,"EASTROC BEVERAGE (GROUP) CO.,LTD.",605499
1813,"Forest Packaging Group Co., Ltd.",605500
1814,Guobang Pharma Ltd.,605507
1815,"Ningbo Dechang Electrical Machinery Made Co., Ltd.",605555
1816,"HANGZHOU FLARIANT CO.,LTD",605566
1817,605567,605567
1818,"Heilongjiang Publishing & Media Co., Ltd.",605577
1819,605580,605580
1820,"Keystone Technology Co.,Ltd.",605588
1821,"Jinan Shengquan Group Share Holding Co.,Ltd.",605589
1822,"Shanghai Geoharbour Construction Group Co., Ltd.",605598
1823,"Beijing Caishikou Department Store Co.,Ltd",605599
1824,"Suzhou HYC Technology CO., LTD",688001
1825,"Raytron Technology Co.,Ltd.",688002
1826,"Suzhou TZTEK Technology Co., Ltd",688003
1827,688004,688004
1828,"Ningbo Ronbay New Energy Technology Co., Ltd.",688005
1829,Zhejiang HangKe Technology Incorporated Company,688006
1830,Appotronics Corporation Limited,688007
1831,"Montage Technology Co., Ltd.",688008
1832,China Railway Signal & Communication Corporation Limited,688009
1833,"Fujian Forecam Optics Co.,Ltd.",688010
1834,"Harbin Xinguang Optic-Electronics Technology Co., Ltd.",688011
1835,Advanced Micro-Fabrication Equipment Inc. China,688012
1836,"Touchstone International Medical Science Co., Ltd.",688013
1837,"Traffic Control Technology Co., Ltd.",688015
1838,"Shanghai MicroPort Endovascular MedTec（Group） Co., Ltd.",688016
1839,Leader Harmonious Drive Systems Co.Ltd,688017
1840,"Espressif Systems (Shanghai) Co.,Ltd",688018
1841,"Anji Microelectronics Technology (Shanghai) Co., Ltd.",688019
1842,"GUANGZHOU FANGBANG ELECTRONICS CO.,LTD",688020
1843,"Aofu Environmental Technology Co., Ltd.",688021
1844,"Suzhou Harmontronics Automation Technology Co., Ltd.",688022
1845,DBAPPsecurity Co.Ltd,688023
1846,"SHENZHEN JPT OPTO-ELECTRONICS CO., LTD.",688025
1847,"Guangzhou Jet Biofiltration Co.,Ltd.",688026
1848,"QuantumCTek Co., Ltd.",688027
1849,"Beijing Worldia Diamond Tools Co.,Ltd.",688028
1850,"MICRO-TECH(NANJING)CO.,LTD",688029
1851,"Hillstone Networks Co.,Ltd.",688030
1852,"Transwarp Technology (Shanghai) Co., Ltd.",688031
1853,Hoymiles Power Electronics Inc.,688032
1854,"Beijing Tianyishangjia New Material Corp., Ltd.",688033
1855,"Darbond Technology Co., Ltd",688035
1856,Transsion Holdings  LTD.CO,688036
1857,"KINGSEMI Co., Ltd.",688037
1858,"Wuhan Citms Technology Co.,Ltd",688038
1859,"Hangzhou Arcvideo Technology Co., Ltd.",688039
1860,"Hygon Information Technology Co., Ltd.",688041
1861,"Shenzhen Kiwi Instruments Co., Ltd",688045
1862,"Gempharmatech Co., Ltd.",688046
1863,Loongson Technology Corporation Limited,688047
1864,"Suzhou Everbright Photonics Co., Ltd.",688048
1865,"Actions Technology Co., Ltd.",688049
1866,"Eyebright Medical Technology (Beijing) Co., Ltd.",688050
1867,688051,688051
1868,"Suzhou Novosense Microelectronics Co., Ltd.",688052
1869,"InfoVision Optoelectronics (Kunshan) Co.,Ltd.",688055
1870,"Beijing LabTech Instruments Co., Ltd.",688056
1871,"Jiangxi JDL Environmental Protection Co., Ltd.",688057
1872,Beijing Baolande Software Corporation.,688058
1873,"Zhuzhou Huarui Precision Cutting Tools.Co.,Ltd",688059
1874,"Jiangsu yunyong electronics and technology Co.,ltd",688060
1875,688061,688061
1876,"Mabwell (Shanghai) Bioscience Co., Ltd.",688062
1877,"Pylon Technologies Co., Ltd.",688063
1878,Cathay Biotech Inc.,688065
1879,"Piesat Information Technology Co.,Ltd",688066
1880,"AVE Science&Technology CO.,LTD",688067
1881,"Beijing Hotgen Biotech Co., Ltd.",688068
1882,"Wuxi Delinhai Environmental Technology Co.,Ltd.",688069
1883,"Chengdu JOUAV Automation Tech Co.,Ltd.",688070
1884,"Shanghai W-Ibeda High Tech.Group Co., Ltd.",688071
1885,Piotech Inc.,688072
1886,"Bide Pharmatech Co., Ltd.",688073
1887,"Assure Tech （Hangzhou） Co., Ltd.",688075
1888,"Earth-Panda Advance Magnetic Material Co., Ltd.",688077
1889,Beijing LongRuan Technologies Inc.,688078
1890,"HANGZHOU MDK OPTO ELECTRONICS CO., LTD",688079
1891,"Beijing InHand Networks Technology Co., Ltd.",688080
1892,"Wuhan Xingtu Xinke Electronics Co.,Ltd.",688081
1893,"ACM Research (Shanghai), Inc.",688082
1894,"ZWSOFT CO., LTD(Guangzhou)",688083
1895,Beijing JingPinTeZhuang Science and Technology Co.，LTD,688084
1896,"Shanghai Sanyou Medical Co., Ltd.",688085
1897,"INTCO RECYCLING RESOURCES CO., LTD.",688087
1898,ArcSoft Corporation Limited,688088
1899,"CABIO Biotech（Wuhan） Co., Ltd.",688089
1900,"GUANGZHOU RISONG INTELLIGENT TECHNOLOGY HOLDING CO., LTD.",688090
1901,"Shanghai Yizhong Pharmaceutical Co.,Ltd.",688091
1902,"Hangzhou IECHO Science & Technology Co., Ltd.",688092
1903,"Suzhou Shihua New Material Technology Co., Ltd.",688093
1904,"Fujian Fuxin Software Development Joint Stock Co.,Ltd",688095
1905,"Jiangsu Jingyuan Environmental Protection Co.,Ltd",688096
1906,"BOZHON PRECISION INDUSTRY TECHNOLOGY CO.,LTD.",688097
1907,Shanghai Shen Lian Biomedical Corporation,688098
1908,"Amlogic (Shanghai) Co., Ltd.",688099
1909,"Willfar Information Technology Co., Ltd.",688100
1910,"SUNTAR ENVIRONMENTAL TECHNOLOGY CO., LTD.",688101
1911,"Shaanxi Sirui Advanced Materials Co.,Ltd.",688102
1912,"Kunshan GuoLi Electronic Technology Co., Ltd",688103
1913,"Nanjing Vazyme Biotech Co., Ltd.",688105
1914,"JINHONG GAS CO., LTD.",688106
1915,"Shanghai Anlogic Infotech Co., Ltd.",688107
1916,SINO MEDICAL SCIENCES TECHNOLOGY INC,688108
1917,"Pinming Technology Co., Ltd",688109
1918,"Dosilicon Co., Ltd.",688110
1919,"Beijing Kingsoft Office Software, Inc.",688111
1920,"Siglent Technologies CO., Ltd.",688112
1921,"Jiangsu Liance Electromechanical Technology Co., Ltd.",688113
1922,"MGI Tech Co., Ltd.",688114
1923,"Smartgiant Technology Co., Ltd.",688115
1924,"Jiangsu Cnano Technology Co.,Ltd.",688116
1925,"ChengDu Sheng Nuo Biotec Co.,Ltd.",688117
1926,"Primeton Information Technologies, Inc.",688118
1927,"Sinosteel Luonai Materials Technology Co., Ltd.",688119
1928,"Hwatsing Technology Co.,Ltd.",688120
1929,"Shanghai Supezet Engineering Technology Corp.,Ltd",688121
1930,"Western Superconducting Technologies Co.,Ltd.",688122
1931,Giantec Semiconductor Corporation,688123
1932,"Guangdong Anda Automation Solutions Co.,Ltd.",688125
1933,"National Silicon Industry Group Co., Ltd.",688126
1934,"Zhejiang Lante Optics Co.,Ltd.",688127
1935,"China National Electric Apparatus Research Institute Co., Ltd.",688128
1936,"DONGLAI COATING TECHNOLOGY（SHANGHAI）CO.,LTD",688129
1937,Hangzhou SDIC Microelectronics Inc.,688130
1938,"Shanghai Haoyuan Chemexpress Co., Ltd.",688131
1939,"Bangyan Technology Co.,Ltd.",688132
1940,"Shanghai Titan Scientific Co.,Ltd.",688133
1941,"Guangdong Leadyo IC Testing Co.,Ltd.",688135
1942,"KEXING BIOPHARM CO., LTD.",688136
1943,Novoprotein Scientific Inc.,688137
1944,Shenzhen Qingyi Photomask Limited,688138
1945,"QINGDAO HAIER BIOMEDICAL CO., LTD.",688139
1946,"JoulWatt Technology Co., Ltd.",688141
1947,"YANGTZE OPTICAL ELECTRONIC Co., LTD.",688143
1948,"Peric Special Gases Co., Ltd.",688146
1949,"Jiangsu Leadmicro Nano Technology Co., Ltd.",688147
1950,"Guangdong Fangyuan New Materials Group Co., Ltd.",688148
1951,"SHAANXI LIGHTE OPTOELECTRONICS MATERIAL CO., LTD",688150
1952,"Hubei Huaqiang High-Tech Co.,Ltd.",688151
1953,"Hunan Kylinsec Technology Co., Ltd.",688152
1954,"Vanchip (Tianjin) Technology Co., Ltd.",688153
1955,"Shanghai SK Automation Technology Co., Ltd.",688155
1956,688156,688156
1957,"SOKAN NEW MATERIALS GROUP CO.,LTD",688157
1958,"UCloud Technology Co., Ltd.",688158
1959,"Shenzhen Neoway Technology Co.,Ltd.",688159
1960,"Kinco Automation（Shanghai）Co., Ltd",688160
1961,688161,688161
1962,"JEE TECHNOLOGY CO., LTD.",688162
1963,"Shanghai Serum Bio-Technology Co., Ltd.",688163
1964,"Efort Intelligent Robot CO.,LTD",688165
1965,"BrightGene Bio-Medical Technology Co.,Ltd.",688166
1966,Focuslight Technologies Inc.,688167
1967,"BEIJING ABT NETWORKS CO., LTD.",688168
1968,"Beijing Roborock Technology Co ., Ltd.",688169
1969,"Suzhou Delphi Laser Co., Ltd.",688170
1970,"Guangdong Weide Information Technology CO,.Ltd.",688171
1971,"Beijing Yandong Microelectronic Co.,Ltd",688172
1972,"Halo Microelectronics Co.,Ltd.",688173
1973,"Zhuhai Comleader Information Science & Technology Co., Ltd.",688175
1974,"Jiangsu Yahong Meditech Co., Ltd.",688176
1975,"Bio-Thera Solutions, Ltd.",688177
1976,"Nanjing Wondux Environmental Protection Technology Corp., Ltd.",688178
1977,"Shanghai Aladdin Biochemical Technology Co., Ltd.",688179
1978,"Shanghai Junshi Biosciences Co., Ltd.",688180
1979,"BeijingBayi Space LCD Technology Co.,Ltd.",688181
1980,"Jiangsu Cai Qin Technology Co., Ltd",688182
1981,"SHENGYI ELECTRONICS CO., LTD.",688183
1982,CanSino Biologics Inc.,688185
1983,"Zhangjiagang Guangda Special Material Co., Ltd.",688186
1984,"Zhuzhou CRRC Times Electric Co., Ltd.",688187
1985,Shanghai Friendess Electronic Technology Corporation Limited,688188
1986,"Hunan Nucien Pharmaceutical Co., Ltd.",688189
1987,"Qingdao Yunlu Advanced Materials Technology Co., Ltd",688190
1988,"Zhiyang Innovation Technology Co.,Ltd.",688191
1989,"Dizal (Jiangsu) Pharmaceutical Co., Ltd.",688192
1990,"Shanghai Rendu Biotechnology Co., Ltd.",688193
1991,"Optowide Technologies Co., Ltd.",688195
1992,"Longyan Zhuoyue New Energy Co., Ltd.",688196
1993,688197,688197
1994,"Beijing Balance Medical Technology Co., Ltd.",688198
1995,"Tianjin Jiuri New Materials Co., Ltd.",688199
1996,"Beijing Huafeng Test & Control Technology Co., Ltd.",688200
1997,"Beijing Infosec Technologies Co., Ltd.",688201
1998,Shanghai Medicilon Inc.,688202
1999,ZHEJIANG HISUN BIOMATERIALS CO.LTD.,688203
2000,"Wuxi Taclink Optoelectronics Technology Co., Ltd.",688205
2001,"PRIMARIUS TECHNOLOGIES CO., LTD",688206
2002,"Beijing Deep Glint Technology Co., Ltd.",688207
2003,"Autel Intelligent Technology Corp., Ltd.",688208
2004,"Shenzhen Injoinic Technology Co., Ltd.",688209
2005,688210,688210
2006,"Wayzim Technology Co., Ltd.",688211
2007,"SHANGHAI AOHUA PHOTOELECTRICITY ENDOSCOPE CO., LTD.",688212
2008,"Smartsens Technology （Shanghai）Co., Ltd，",688213
2009,688215,688215
2010,"China Chippacking Technology Co.,Ltd.",688216
2011,"Shanghai Rightongene Biotechnology Co., Ltd.",688217
2012,"Jiangsu Beiren Smart Manufacturing Technology Co., Ltd.",688218
2013,"Orinko Advanced Plastics Co.,LTD.",688219
2014,"ASR Microelectronics Co., Ltd",688220
2015,Frontier Biotechnologies Inc.,688221
2016,HitGen Inc.,688222
2017,"Jinko Solar Co., Ltd.",688223
2018,"Asiainfo Security Technologies Co., Ltd.",688225
2019,"Wetown Electric Group Co., Ltd.",688226
2020,"Bingo Software Co., Ltd.",688227
2021,"Ucap Cloud Information Technology Co.,Ltd.",688228
2022,"BONREE DATA TECHNOLOGY CO., LTD.",688229
2023,"Shanghai Prisemi Electronics Co., Ltd.",688230
2024,"JIANGSU LONGDA SUPERALLOY CO., LTD.",688231
2025,"GUOTAI EPOINT SOFTWARE CO.,LTD.",688232
2026,Thinkon Semiconductor Jinzhou Corp.,688233
2027,"SICC Co., Ltd.",688234
2028,BeOne Medicines Ltd.,688235
2029,"Beijing Chunlizhengda Medical Instruments Co.,Ltd.",688236
2030,688237,688237
2031,"Obio Technology (Shanghai) Corp., Ltd",688238
2032,"Guizhou Aviation Technical Development Co.,Ltd.",688239
2033,Integrity Technology Group Inc.,688244
2034,"Goodwill E-Health Info Co., Ltd.",688246
2035,Sinotherapeutics Inc.,688247
2036,688248,688248
2037,Nexchip Semiconductor Corporation,688249
2038,"Hefei Jingsong Intelligent Technology Co.,Ltd.",688251
2039,JADARD TECHNOLOGY INC.,688252
2040,"Innovita Biological Technology Co., Ltd.",688253
2041,"Hangzhou Kaierda Welding Robot Co.,Ltd",688255
2042,Cambricon Technologies Corporation Limited,688256
2043,Shareate Tools LTD.,688257
2044,"Jiangsu Eazytec Co.,Ltd",688258
2045,Triductor Technology（Suzhou） Inc.，,688259
2046,"SUZHOU GYZ ELECTRONIC TECHNOLOGY CO., LTD.",688260
2047,Suzhou Oriental Semiconductor Company Limited,688261
2048,688262,688262
2049,"Shanghai Model Organisms Center, Inc",688265
2050,"Suzhou Zelgen Biopharmaceuticals Co.,Ltd",688266
2051,"China Catalyst Holding Co.,Ltd.",688267
2052,"Guangdong Huate Gas Co.,LTD",688268
2053,"Kaili Catalyst & New Materials Co.,Ltd.",688269
2054,"Great Microwave Technology Co.,Ltd.",688270
2055,"Shanghai United Imaging Healthcare Co., Ltd.",688271
2056,"Beijing Fjr Optoelectronic Technology Co., Ltd.",688272
2057,"NANJING MEDLANDER MEDICAL TECHOLOGY CO.,LTD",688273
2058,"Hubei Wanrun New Energy Technology Co., Ltd.",688275
2059,Changchun BCHT Biotechnology.Co.,688276
2060,"Tinavi Medical Technologies Co.,Ltd.",688277
2061,"Xiamen Amoytop Biotech Co., LTD.",688278
2062,"Fortior Technology（Shenzhen）Co., Ltd.",688279
2063,"Jing-Jin Electric Technologies Co., Ltd.",688280
2064,"Shaanxi Huaqin Technology Industry Co., Ltd.",688281
2065,"Beijing Navigation Control Technology Co.,Ltd",688282
2066,"Chengdu KSW Technologies Co.,Ltd.",688283
2067,688285,688285
2068,"Memsensing Microsystems（Suzhou, China）Co.,Ltd.",688286
2069,"Hangzhou Hopechart IoT Technology Co., Ltd.",688288
2070,Sansure Biotech Inc.,688289
2071,"Hangzhou Jingye Intelligent Technology Co., Ltd.",688290
2072,"Beijing JCZ Technology Co.,Ltd.",688291
2073,"Beijing Haohan Data Technology Co., Ltd.",688292
2074,"Shanghai OPM Biosciences Co., Ltd.",688293
2075,"Zhongfu Shenying Carbon Fiber Co., Ltd",688295
2076,"Zhejiang Heda Technology Co., Ltd.",688296
2077,688297,688297
2078,"Zhejiang Orient Gene Biotech Co., Ltd",688298
2079,"Ningbo Solartron Technology Co., Ltd.",688299
2080,NOVORAY CORPORATION,688300
2081,iRay Group,688301
2082,Hinova Pharmaceuticals Inc.,688302
2083,688303,688303
2084,"KEDE NUMERICAL CONTROL CO.,LTD.",688305
2085,Ningbo PIA Automation Holding Corp.,688306
2086,"JIAXING ZMAX OPTEC CO.,LTD",688307
2087,"OKE PRECISION CUTTING TOOLS CO.,LTD",688308
2088,688309,688309
2089,"Maider Medical Industry Equipment Co., Ltd.",688310
2090,688311,688311
2091,Shenzhen Yanmade Technology Inc.,688312
2092,"Henan ShiJia Photons Technology Co.,LTD",688313
2093,"Kontour(Xi'an) Medical Technology Co., Ltd.",688314
2094,"Novogene Co., Ltd.",688315
2095,"Beijing QingCloud Technology Group Co.,Ltd",688316
2096,Shanghai ZJ Bio-Tech Co.，Ltd.,688317
2097,"Shenzhen Fortune Trend Technology Co., Ltd",688318
2098,688319,688319
2099,688320,688320
2100,"Shenzhen Chipscreen Biosciences Co., Ltd",688321
2101,Orbbec Inc.,688322
2102,Rayitek Hi-Tech Film Company. Ltd. Shenzhen,688323
2103,"Guangdong Cellwise Microelectronics Co., Ltd",688325
2104,"Beijing Jingwei Hirain Technologies Co., Inc.",688326
2105,"CloudWalk Technology Co., Ltd.",688327
2106,"Shenzhen S-king Intelligent Equipment Co., Ltd.",688328
2107,"Suzhou Iron Technology CO.,LTD.",688329
2108,"Shanghai Holystar Electrical Technology Co., Ltd.",688330
2109,"Remegen Co.,Ltd.",688331
2110,"Shenzhen Bluetrum Technology Co.,Ltd",688332
2111,"Xi'an Bright Laser Technologies Co., Ltd",688333
2112,"Xi’an High Voltage Apparatus Research Institute Co., Ltd.",688334
2113,688335,688335
2114,"Sunshine Guojian Pharmaceutical(Shanghai)Co,.Ltd",688336
2115,"RIGOL TECHNOLOGIES CO., LTD.",688337
2116,Beijing Succeeder Technology INC.,688338
2117,"Beijing SinoHytec Co., Ltd.",688339
2118,"Shenzhen Intellifusion Technologies Co., Ltd.",688343
2119,688345,688345
2120,HUA HONG SEMICONDUCTOR LIMITED,688347
2121,"Yuneng Technology Co., Ltd.",688348
2122,"Sany Renewable Energy Co.,Ltd.",688349
