,Company Name,Company Code
0,"SHANGHAI PUDONG DEVELOPMENT BANK CO., LTD.",600000
1,"Guangzhou Baiyun International Airport Co.,ltd.",600004
2,"Dongfeng  Automobile  Co.,LTD",600006
3,China World Trade Center Company Ltd.,600007
4,"Beijing Capital Eco-Environment Protection Group Co.,Ltd.",600008
5,"Shanghai International Airport Co., Ltd.",600009
6,"Inner Mongolia BaoTou Steel Union Co.,Ltd.",600010
7,"Huaneng Power International, INC.",600011
8,Anhui Expressway Company Limited,600012
9,"HUA XIA BANK CO., Limited",600015
10,CHINA MINSHENG BANK,600016
11,"RIZHAO PORT CO.,LTD.",600017
12,"Shanghai International Port (Group) Co., Ltd",600018
13,"Baoshan Iron & Steel Co., Ltd.",600019
14,Henan Zhongyuan Expressway Company Limited,600020
15,SHANGHAI ELECTRIC POWER COMPANY LIMITED,600021
16,SHANDONG IRON AND STEEL COMPANY LTD,600022
17,"Zhejiang Zheneng Electric Power Co.,Ltd",600023
18,Huaneng Lancang River Hydropower Inc.,600025
19,"COSCO SHIPPING Energy Transportation Co., Ltd.",600026
20,Huadian Power International Corporation Limited,600027
21,China Petroleum & Chemical Corporation,600028
22,China Southern Airlines Company Limited,600029
23,CITIC Securities Company Limited,600030
24,"SANY HEAVY INDUSTRY CO.,LTD",600031
25,"Zhejiang Provincial New Energy Investment Group Co., Ltd.",600032
26,Fujian Expressway Development Company Limited,600033
27,"Hubei Chutian Smart Communication Co.,Ltd.",600035
28,"China Merchants Bank Co., Ltd.",600036
29,"Beijing Gehua CATV Network Co., LTD.",600037
30,AVICOPTER PLC,600038
31,"Sichuan Road & Bridge Group Co.,Ltd.",600039
32,"Poly Developments and Holdings Group Co., Ltd.",600048
33,CHINA UNITED NETWORK COMMUNICATIONS  LIMITED,600050
34,"NINGBO UNITED GROUP CO.,LTD.",600051
35,"Zhejiang Dongwang Times Technology Co., Ltd.",600052
36,"Kunwu Jiuding Investment Holdings CO., Ltd",600053
37,"Huangshan Tourism Development Co.,Ltd.",600054
38,"Beijing Wandong Medical Technology Co., Ltd.",600055
39,"CHINA MEHECO GROUP CO., LTD.",600056
40,"XIAMEN XIANGYU CO., LTD.",600057
41,"MINMETALS DEVELOPMENT CO., LTD.",600058
42,ZheJiang GuYueLongShan ShaoXing Wine Co.LTD,600059
43,"Hisense Visual Technology Co., Ltd.",600060
44,"SDIC Capital Co., Ltd",600061
45,"CHINA RESOURCES DOUBLE－CRANE PHARMACEUTICAL CO.,LTD.",600062
46,ANHUI WANWEI UPDATED HIGH-TECH MATERIAL INDUSTRY COMPANY LIMITED,600063
47,NANJING GAOKE COMPANY LIMITED,600064
48,"YUTONG BUS CO., LTD.",600066
49,"CITYCHAMP DARTONG ADVANCED MATERIALS CO.,LTD.",600067
50,phenix optics  company limited,600071
51,"CSSC Science & Technology Co., Ltd",600072
52,"SHANGHAI BRIGHT MEAT GROUP CO.,LTD.",600073
53,"XINJIANG TIANYE CO.,LTD.",600075
54,"Kangxin New Materials Co., Ltd.",600076
55,"Jiangsu Chengxing Phosph-Chemical Co.,Ltd",600078
56,GINWA ENTERPRISE(GROUP) INC.,600080
57,"DONG FENG ELECTRONIC TECHNOLOGY CO.,LITD.",600081
58,"Tianjin Hi-Tech Development Co., Ltd.",600082
59,"CITIC NIYA WINE CO., LTD.",600084
60,"BEIJING TONG REN TANG CO., LTD",600085
61,"China Television Media,Ltd.",600088
62,"TBEA CO.,LTD.",600089
63,GREATTOWN HOLDINGS LTD.,600094
64,"XIANGCAI CO.,LTD",600095
65,"YUNNAN YUNTIANHUA CO.,LTD",600096
66,"SHANGHAI KAICHUANG MARINE INTERNATIONAL CO.,LTD.",600097
67,Guangzhou Development Group Incorporated,600098
68,"LINHAI CO.,LTD.",600099
69,"TSINGHUA TONGFANG CO., LTD",600100
70,"SICHUAN MINGXING ELECTRIC POWER CO.,LTD",600101
71,"Fujian Qingshan Paper Industry Co.,Ltd.",600103
72,SAIC Motor Corporation Limited,600104
73,"JIANGSU ETERN CO., LTD.",600105
74,"CHONGQING ROAD & BRIDGE CO.,LTD",600106
75,"GANSU YASHENG INDUSTRIAL（GROUP）CO.,LTD",600108
76,"SINOLINK SECURITIES CO., LTD.",600109
77,"NUODE INVESTMENT CO.,LTD",600110
78,"China Northern Rare Earth (Group) High-Tech Co.,Ltd",600111
79,"ZHE JIANG DONG RI CO., LTD",600113
80,"NBTM NEW MATERIALS GROUP Co., Ltd.",600114
81,China Eastern Airlines Corporation Limited,600115
82,"Chongqing Three Gorges Water Conservancy And Electric Power Co.,Ltd.",600116
83,"XINING SPECIAL STEEL CO.,LTD",600117
84,"China Spacesat Co.,Ltd.",600118
85,"Y.U.D Yangtze River Investment Industry Co.,Ltd.",600119
86,"Zhejiang Orient Financial Holdings Group Co., Ltd.",600120
87,"ZHENGZHOU COAL INDUSTRY & ELECTRIC POWER CO.,LTD.",600121
88,"Shanxi Lanhua Sci-tech Venture Co.,Ltd",600123
89,"CHINA RAILWAY TIELONG CONTAINER LOGISTICS CO., LTD",600125
90,"HangZhou Iron And Steel Co.,Ltd.",600126
91,"JINJIAN CEREALS INDUSTRY CO.,LTD.",600127
92,SOHO HOLLY CORPORATION,600128
93,"CHONGQING TAIJI INDUSTRY(GROUP) CO.,LTD",600129
94,"STATE GRID INFORMATION&COMMUNICATION CO.,LTD.",600131
95,Chongqing Brewery Company Limited,600132
96,"WUHAN EAST LAKE HIGH TECHNOLOGY GROUPE CO.,LTD.",600133
97,LUCKY FILM COMPANY LIMITED,600135
98,Sichuan Langsha　holding　CO.LTD,600137
99,"CHINA CYTS TOURS HOLDING CO.,LTD.",600138
100,phenix optics  company limited,600071
101,"CSSC Science & Technology Co., Ltd",600072
102,"SHANGHAI BRIGHT MEAT GROUP CO.,LTD.",600073
103,"XINJIANG TIANYE CO.,LTD.",600075
104,"Kangxin New Materials Co., Ltd.",600076
105,"Jiangsu Chengxing Phosph-Chemical Co.,Ltd",600078
106,GINWA ENTERPRISE(GROUP) INC.,600080
107,"DONG FENG ELECTRONIC TECHNOLOGY CO.,LITD.",600081
108,"Tianjin Hi-Tech Development Co., Ltd.",600082
109,"CITIC NIYA WINE CO., LTD.",600084
110,"BEIJING TONG REN TANG CO., LTD",600085
111,"China Television Media,Ltd.",600088
112,"TBEA CO.,LTD.",600089
113,GREATTOWN HOLDINGS LTD.,600094
114,"XIANGCAI CO.,LTD",600095
115,"YUNNAN YUNTIANHUA CO.,LTD",600096
116,"SHANGHAI KAICHUANG MARINE INTERNATIONAL CO.,LTD.",600097
117,Guangzhou Development Group Incorporated,600098
118,"LINHAI CO.,LTD.",600099
119,"TSINGHUA TONGFANG CO., LTD",600100
120,"SICHUAN MINGXING ELECTRIC POWER CO.,LTD",600101
121,"Fujian Qingshan Paper Industry Co.,Ltd.",600103
122,SAIC Motor Corporation Limited,600104
123,"JIANGSU ETERN CO., LTD.",600105
124,"CHONGQING ROAD & BRIDGE CO.,LTD",600106
125,"GANSU YASHENG INDUSTRIAL（GROUP）CO.,LTD",600108
126,"SINOLINK SECURITIES CO., LTD.",600109
127,"NUODE INVESTMENT CO.,LTD",600110
128,"China Northern Rare Earth (Group) High-Tech Co.,Ltd",600111
129,"ZHE JIANG DONG RI CO., LTD",600113
130,"NBTM NEW MATERIALS GROUP Co., Ltd.",600114
131,China Eastern Airlines Corporation Limited,600115
132,"Chongqing Three Gorges Water Conservancy And Electric Power Co.,Ltd.",600116
133,"XINING SPECIAL STEEL CO.,LTD",600117
134,"China Spacesat Co.,Ltd.",600118
135,"Y.U.D Yangtze River Investment Industry Co.,Ltd.",600119
136,"Zhejiang Orient Financial Holdings Group Co., Ltd.",600120
137,"ZHENGZHOU COAL INDUSTRY & ELECTRIC POWER CO.,LTD.",600121
138,"Shanxi Lanhua Sci-tech Venture Co.,Ltd",600123
139,"CHINA RAILWAY TIELONG CONTAINER LOGISTICS CO., LTD",600125
140,"HangZhou Iron And Steel Co.,Ltd.",600126
141,"JINJIAN CEREALS INDUSTRY CO.,LTD.",600127
142,SOHO HOLLY CORPORATION,600128
143,"CHONGQING TAIJI INDUSTRY(GROUP) CO.,LTD",600129
144,"STATE GRID INFORMATION&COMMUNICATION CO.,LTD.",600131
145,Chongqing Brewery Company Limited,600132
146,"WUHAN EAST LAKE HIGH TECHNOLOGY GROUPE CO.,LTD.",600133
147,LUCKY FILM COMPANY LIMITED,600135
148,Sichuan Langsha　holding　CO.LTD,600137
149,"CHINA CYTS TOURS HOLDING CO.,LTD.",600138
150,phenix optics  company limited,600071
151,"CSSC Science & Technology Co., Ltd",600072
152,"SHANGHAI BRIGHT MEAT GROUP CO.,LTD.",600073
153,"XINJIANG TIANYE CO.,LTD.",600075
154,"Kangxin New Materials Co., Ltd.",600076
155,"Jiangsu Chengxing Phosph-Chemical Co.,Ltd",600078
156,GINWA ENTERPRISE(GROUP) INC.,600080
157,"DONG FENG ELECTRONIC TECHNOLOGY CO.,LITD.",600081
158,"Tianjin Hi-Tech Development Co., Ltd.",600082
159,"CITIC NIYA WINE CO., LTD.",600084
160,"BEIJING TONG REN TANG CO., LTD",600085
161,"China Television Media,Ltd.",600088
162,"TBEA CO.,LTD.",600089
163,GREATTOWN HOLDINGS LTD.,600094
164,"XIANGCAI CO.,LTD",600095
165,"YUNNAN YUNTIANHUA CO.,LTD",600096
166,"SHANGHAI KAICHUANG MARINE INTERNATIONAL CO.,LTD.",600097
167,Guangzhou Development Group Incorporated,600098
168,"LINHAI CO.,LTD.",600099
169,"TSINGHUA TONGFANG CO., LTD",600100
170,"SICHUAN MINGXING ELECTRIC POWER CO.,LTD",600101
171,"Fujian Qingshan Paper Industry Co.,Ltd.",600103
172,SAIC Motor Corporation Limited,600104
173,"JIANGSU ETERN CO., LTD.",600105
174,"CHONGQING ROAD & BRIDGE CO.,LTD",600106
175,"GANSU YASHENG INDUSTRIAL（GROUP）CO.,LTD",600108
176,"SINOLINK SECURITIES CO., LTD.",600109
177,"NUODE INVESTMENT CO.,LTD",600110
178,"China Northern Rare Earth (Group) High-Tech Co.,Ltd",600111
179,"ZHE JIANG DONG RI CO., LTD",600113
180,"NBTM NEW MATERIALS GROUP Co., Ltd.",600114
181,China Eastern Airlines Corporation Limited,600115
182,"Chongqing Three Gorges Water Conservancy And Electric Power Co.,Ltd.",600116
183,"XINING SPECIAL STEEL CO.,LTD",600117
184,"China Spacesat Co.,Ltd.",600118
185,"Y.U.D Yangtze River Investment Industry Co.,Ltd.",600119
186,"Zhejiang Orient Financial Holdings Group Co., Ltd.",600120
187,"ZHENGZHOU COAL INDUSTRY & ELECTRIC POWER CO.,LTD.",600121
188,"Shanxi Lanhua Sci-tech Venture Co.,Ltd",600123
189,"CHINA RAILWAY TIELONG CONTAINER LOGISTICS CO., LTD",600125
190,"HangZhou Iron And Steel Co.,Ltd.",600126
191,"JINJIAN CEREALS INDUSTRY CO.,LTD.",600127
192,SOHO HOLLY CORPORATION,600128
193,"CHONGQING TAIJI INDUSTRY(GROUP) CO.,LTD",600129
194,"STATE GRID INFORMATION&COMMUNICATION CO.,LTD.",600131
195,Chongqing Brewery Company Limited,600132
196,"WUHAN EAST LAKE HIGH TECHNOLOGY GROUPE CO.,LTD.",600133
197,LUCKY FILM COMPANY LIMITED,600135
198,Sichuan Langsha　holding　CO.LTD,600137
199,"CHINA CYTS TOURS HOLDING CO.,LTD.",600138
200,phenix optics  company limited,600071
201,"CSSC Science & Technology Co., Ltd",600072
202,"SHANGHAI BRIGHT MEAT GROUP CO.,LTD.",600073
203,"XINJIANG TIANYE CO.,LTD.",600075
204,"Kangxin New Materials Co., Ltd.",600076
205,"Jiangsu Chengxing Phosph-Chemical Co.,Ltd",600078
206,GINWA ENTERPRISE(GROUP) INC.,600080
207,"DONG FENG ELECTRONIC TECHNOLOGY CO.,LITD.",600081
208,"Tianjin Hi-Tech Development Co., Ltd.",600082
209,"CITIC NIYA WINE CO., LTD.",600084
210,"BEIJING TONG REN TANG CO., LTD",600085
211,"China Television Media,Ltd.",600088
212,"TBEA CO.,LTD.",600089
213,GREATTOWN HOLDINGS LTD.,600094
214,"XIANGCAI CO.,LTD",600095
215,"YUNNAN YUNTIANHUA CO.,LTD",600096
216,"SHANGHAI KAICHUANG MARINE INTERNATIONAL CO.,LTD.",600097
217,Guangzhou Development Group Incorporated,600098
218,"LINHAI CO.,LTD.",600099
219,"TSINGHUA TONGFANG CO., LTD",600100
220,"SICHUAN MINGXING ELECTRIC POWER CO.,LTD",600101
221,"Fujian Qingshan Paper Industry Co.,Ltd.",600103
222,SAIC Motor Corporation Limited,600104
223,"JIANGSU ETERN CO., LTD.",600105
224,"CHONGQING ROAD & BRIDGE CO.,LTD",600106
225,"GANSU YASHENG INDUSTRIAL（GROUP）CO.,LTD",600108
226,"SINOLINK SECURITIES CO., LTD.",600109
227,"NUODE INVESTMENT CO.,LTD",600110
228,"China Northern Rare Earth (Group) High-Tech Co.,Ltd",600111
229,"ZHE JIANG DONG RI CO., LTD",600113
230,"NBTM NEW MATERIALS GROUP Co., Ltd.",600114
231,China Eastern Airlines Corporation Limited,600115
232,"Chongqing Three Gorges Water Conservancy And Electric Power Co.,Ltd.",600116
233,"XINING SPECIAL STEEL CO.,LTD",600117
234,"China Spacesat Co.,Ltd.",600118
235,"Y.U.D Yangtze River Investment Industry Co.,Ltd.",600119
236,"Zhejiang Orient Financial Holdings Group Co., Ltd.",600120
237,"ZHENGZHOU COAL INDUSTRY & ELECTRIC POWER CO.,LTD.",600121
238,"Shanxi Lanhua Sci-tech Venture Co.,Ltd",600123
239,"CHINA RAILWAY TIELONG CONTAINER LOGISTICS CO., LTD",600125
240,"HangZhou Iron And Steel Co.,Ltd.",600126
241,"JINJIAN CEREALS INDUSTRY CO.,LTD.",600127
242,SOHO HOLLY CORPORATION,600128
243,"CHONGQING TAIJI INDUSTRY(GROUP) CO.,LTD",600129
244,"STATE GRID INFORMATION&COMMUNICATION CO.,LTD.",600131
245,Chongqing Brewery Company Limited,600132
246,"WUHAN EAST LAKE HIGH TECHNOLOGY GROUPE CO.,LTD.",600133
247,LUCKY FILM COMPANY LIMITED,600135
248,Sichuan Langsha　holding　CO.LTD,600137
249,"CHINA CYTS TOURS HOLDING CO.,LTD.",600138
250,"HUBEI XINGFA CHEMICALS GROUP CO.,LTD.",600141
251,"KINGFA SCI.&TECH. CO.,LTD.",600143
252,Changchun Yidong Clutch CO.LTD.,600148
253,"Langfang Development Co., Ltd.",600149
254,China CSSC Holdings Limited,600150
255,"SHANGHAI AEROSPACE AUTOMOBILE ELECTROMECHANICAL CO.,LTD",600151
256,"VEKEN TECHNOLOGY.,LTD.",600152
257,XIAMEN C&D INC.,600153
258,"Polaris Bay Group Co.,Ltd.",600155
259,"Hunan Huasheng  Co.,Ltd",600156
260,"WINTIME ENERGY GROUP CO.,LTD.",600157
261,CHINA SPORTS INDUSTRY GROUP CO.，LTD.,600158
262,"BEIJING  DALONG  WEIYE REAL ESTATE DEVELOPMENT  CO.,LTD",600159
263,"ZHEJIANG JUHUA CO.,LTD.",600160
264,Beijing Tiantan Biological Products Corporation Limited,600161
265,"Shenzhen Heungkong Holding Co., Ltd",600162
266,"ZHONGMIN  ENERGY  CO.,  LTD.",600163
267,"BEIQI FOTON MOTOR CO.,LTD.",600166
268,"Luenmei Quantum Co.,Ltd",600167
269,"WUHAN SANZHEN INDUSTRY HOLDING CO.,LTD",600168
270,"SHANGHAI CONSTRUCTION GROUP CO., LTD",600170
271,"SHANGHAI BELLING CO.,LTD.",600171
272,"HENAN HUANGHE WHIRLWIND CO.,LTD.",600172
273,"Wolong New Energy Group Co., Ltd.",600173
274,"China Jushi Co.,Ltd.",600176
275,"Youngor Fashion Co.,Ltd.",600177
276,"HARBIN DONGAN AUTO ENGINE CO.,LTD.",600178
277,"Antong Holdings Co., Ltd.",600179
278,"CCS Supply Chain Management Co., Ltd.",600180
279,GITI TIRE CORPORATION,600182
280,"SHENGYI TECHNOLOGY CO., LTD.",600183
281,"North Electro-Optic Co.,Ltd.",600184
282,"ZHUHAI ZHUMIAN GROUP Co., Ltd",600185
283,"Lotus Holdings Co.,Ltd.",600186
284,"HEILONGJIANG INTERCHINA WATER TREATMENT CO.,LTD.",600187
285,Yankuang Energy Group Company Limited,600188
286,"JILIN QUANYANGQUAN Co.,Ltd",600189
287,"BAOTOU HUAZI INDUSTRY CO.,LTD.",600191
288,"LANZHOU GREATWALL ELECTRICAL CO.,LTD.",600192
289,"China Animal Husbandry Industry Co.,Ltd.",600195
290,"Shanghai Fosun Pharmaceutical (Group) Co., Ltd.",600196
291,"Xinjiang Yilite Industry Co.,LTD.",600197
292,"DATANG TELECOM TECHNOLOGY CO., LTD.",600198
293,"Anhui Golden Seed Winery Co.,Ltd.",600199
294,JINYU BIO-TECHNOLOGY CO.，LTD.,600201
295,"Harbin Air Conditioning Co.,Ltd.",600202
296,"FUJIAN FURI ELECTRONICS CO.,LTD.",600203
297,"GRINM Advanced Materials Co.,Ltd.",600206
298,"HENAN ANCAI HI-TECH CO.,LTD.",600207
299,"Quzhou Xin'an Development Co.,Ltd.",600208
300,"SHANGHAI ZIJIANG ENTERPRISE GROUP CO.,LTD",600210
301,TIBET RHODIOLA PHARMACEUTICAL HOLDING CO.,600211
302,"GRESGYING DIGITAL ENERGY TECHNOLOGY CO.,LTD",600212
303,"Paslin digital technology co., ltd.",600215
304,"ZHEJIANG MEDICINE CO.,LTD",600216
305,"China Resources and Environment Co.,ltd.",600217
306,"ANHUI QUANCHAI ENGINE CO.,LTD.",600218
307,"SHANDONG NANSHAN ALUMINIUM CO., LTD",600219
308,Hainan Airlines Holding Company Limited,600221
309,"HENAN TALOPH PHARMACEUTICAL STOCK CO.,LTD",600222
310,"Lushang Freda Pharmaceutical Co., Ltd.",600223
311,"Zhejiang Hengtong Holding Co.,Ltd.",600226
312,"GUIZHOU CHITIANHUA CO.,LTD.",600227
313,"Qingdao Citymedia Co,. Ltd.",600229
314,CANGZHOU DAHUA CO.LTD,600230
315,"Lingyuan Iron & Steel Co.,Ltd.",600231
316,"Zhejiang Golden Eagle Co.,Ltd.",600232
317,"YTO Express Group Co.,Ltd.",600233
318,"Kexin Development Co.,Ltd,Shanxi",600234
319,"MINFENG SPECIAL PAPER CO.,LTD.",600235
320,"Guangxi Guiguan Electric Power Co.,Ltd.",600236
321,ANHUI TONGFENG ELECTRONICS COMPANY LIMITED,600237
322,"YunNan  Metropolitan Real Estate Development Co.,LTD",600239
323,"LIAONING SHIDAI_WANHENG CO.,LTD.",600241
324,"Vantone Neo Development Group Co., Ltd",600246
325,Shaanxi Construction Engineering Group Corporation Limited,600248
326,"LIUZHOU LIANGMIANZHEN Co., Ltd.",600249
327,"NANJING BUSINESS & TOURISM CORP.,LTD.",600250
328,"XINJIANG GUANNONG CO.,LTD.",600251
329,"Guangxi Wuzhou Zhongheng Group CO.,LTD.",600252
330,ANHUI XINKE NEW MATERIALS CO.，LTD.,600255
331,"GUANGHUI ENERGY CO.,LTD.",600256
332,"DAHU HEALTH INDUSTRY CO.,LTD.",600257
333,BTG HOTELS（GROUP）CO.，LTD,600258
334,"China Rare Earth NonferrousMetals Co.,Ltd.",600259
335,"ZHEJIANG YANKON GROUP CO.,LTD.",600261
336,"Inner Mongolia North Hauler Joint Stock Co.,Ltd.",600262
337,"BEIJING URBAN CONSTRUCTION INVESTMENT& DEVELOPMENT CO.,LTD.",600266
338,"ZHEJIANG HISUN PHARMACEUTICAL CO.,LTD",600267
339,"Guodian Nanjing Automation Co.,LTD.",600268
340,"Jiangxi Ganyue Expressway CO.,LTD.",600269
341,Aisino Corporation,600271
342,"SHANGHAI KAI KAI INDUSTRIAL CO.,LTD.",600272
343,"Zhejiang Jiahua energy chemical industry Co.,Ltd.",600273
344,"Jiangsu Hengrui Pharmaceuticals Co.,Ltd.",600276
345,Orient International Enterprise LTD.,600278
346,"Chongqing Port Co.,Ltd.",600279
347,"NANJING CENTRAL EMPORIUM STOCKS CO., LTD.",600280
348,"SHAN XI HUA YANG NEW MATERIALS CO.,LTD.",600281
349,"Nanjing Iron&Steel Co.,Ltd.",600282
350,"Qianjiang Water Resources Development Co.,Ltd",600283
351,"Shanghai Pudong Construction Co.,Ltd.",600284
352,"Henan Lingrui Pharmaceutical Co., Ltd",600285
353,"SOHO FASHION GROUP CO.,LTD.",600287
354,"Daheng New Epoch Technology,Inc.",600288
355,"SPIC YUANDA ENVIRONMENTAL—PROTECTION CO. ,LTD .",600292
356,"HUBEI SANXIA NEW BUILDING MATERIALS CO.,LTD",600293
357,"Inner Mongolia ERDOS Resources Co.,Ltd.",600295
358,"ANGEL YEAST CO.,LTD",600298
359,Bluestar Adisseo Company,600299
360,"v v Food & Beverage Co.,Ltd",600300
361,"Guangxi Huaxi Nonferrous Metal Co.,Ltd",600301
362,"XI'AN TYPICAL INDUSTRIES CO., LTD",600302
363,"LIAONING SG AUTOMOTIVE GROUP CO., LTD.",600303
364,"JIANGSHU  HENGSHUN  VINEGAR  CO.,LTD",600305
365,"GanSu Jiu Steel Group Hong Xing Iron & Steel Co,Ltd",600307
366,"SHANDONG HUATAI PAPER INDUSTRY SHAREHOLDING CO.,LTD",600308
367,"Wanhua Chemical Group Co.,Ltd.",600309
368,Guangxi Energy Co.，Ltd.,600310
369,"Henan Pinggao Electric Co.,Ltd.",600312
370,"ZHONGNONGFA  SEED  INDUSTRY  GROUP  CO., LTD.",600313
371,"SHANGHAI JAHWA UNITED CO., LTD",600315
372,"JIANGXI HONGDU AVIATION INDUSTRY CO., LTD.",600316
373,"ANHUI XINLI FINANCE CO.,LTD.",600318
374,"WEIFANG YAXING CHEMICAL CO.,LTD.",600319
375,"SHANGHAI ZHENHUA HEAVY INDUSTRIES CO.,LTD.",600320
376,"Tianjin Jintou State-owned Urban Development Co., Ltd.",600322
377,Grandblue environment company limited,600323
378,"Zhuhai Huafa Properties Co.,LTD.",600325
379,"XIZANGTIANLUCO., LTD.",600326
380,"WUXI COMMERCIAL MANSION GRAND ORIENT CO.,LTD",600327
381,"CNSIG Inner Mongolia Chemical Industry Co., Ltd.",600328
382,TIANJIN PHARMACEUTICAL DA REN TANG GROUP CORPORATION LIMITED,600329
383,"TDG HOLDING CO.,LTD.",600330
384,"SICHUAN  HONGDA CO.,LTD.",600331
385,Guangzhou Baiyunshan Pharmaceutical Holdings Company Limited,600332
386,"Changchun Gas Co.,Ltd",600333
387,"Sinomach Automobile Co., Ltd.",600335
388,AUCMA COMPANY LIMITED,600336
389,"Markor International Home Furnishings Co., Ltd.",600337
390,"XIZANG ZHUFENG RESOURCES CO.,LTD.",600338
391,"China Petroleum Engineering Co., Ltd.",600339
392,CHINA FORTUNE LAND DEVELOPMENT CO.，LTD.,600340
393,"SHAANXI AEROSPACE POWER HI-TECH CO.,LTD",600343
394,"Wuhan Yangtze Communications Industry Group Co.,Ltd.",600345
395,"HENGLI PETROCHEMICAL CO.,LTD.",600346
396,"SHAN XI HUA YANG GROUP NEW ENERGY CO.,LTD.",600348
397,Shandong Hi-speed Company Limited,600350
398,"YABAO PHARMACEUTICAL GROUP CO., LTD.",600351
399,"Zhejiang Longsheng Group Co.,ltd",600352
400,"CHENGDU XUGUANG ELECTRONICS CO,.LTD",600353
401,"Gansu Dunhuang Seed Co.,Ltd.",600354
402,"MUDANJIANG HENGFENG PAPER CO.,LTD.",600356
403,"Xinjiang Talimu Agriculture Development Co.,Ltd.",600359
404,"INNOVATION NEW MATERIAL TECHNOLOGY CO., LTD.",600361
405,Jiangxi Copper Company Limited,600362
406,"JIANXI LIANCHUANG OPTO-ELECTRONIC SCIENCE&TECHNOLOGY CO.,LTD",600363
407,"NINGBO YUNSHENG  CO.,LTD.",600366
408,"GUIZHOU REDSTAR DEVELOPING CO.,LTD.",600367
409,"GUANGXI WUZHOU COMMUNICATIONS CO.,LTD.",600368
410,Southwest Securities Co.，Ltd.,600369
411,"Jiangsu Sanfame Polyester Material Co.,Ltd.",600370
412,"WanXiang Doneed CO. ,LTD.",600371
413,"AVIC Airborne Systems Co., Ltd.",600372
414,"CHINESE UNIVERSE PUBLISHING AND MEDIA GROUP CO., LTD.",600373
415,"HANMA TECHNOLOGY GROUP CO.,LTD.",600375
416,"Beijing Capital Development,Co.,Ltd",600376
417,Jiangsu Expressway Company Limited,600377
418,"Haohua Chemical Science & Technology Corp., Ltd.",600378
419,"SHAANXI BAOGUANG VACUUM ELECTRIC DEVICE CO., LTD.",600379
420,"Joincare Pharmaceutical Group Industry Co.,Ltd.",600380
421,"Guangdong Mingzhu Group Co.,Ltd.",600382
422,Gemdale Corporation,600383
423,"BEIJING BASHI MEDIA CO,.LTD",600386
424,"Fujian Longking Co.,LTD",600388
425,"Nantong Jiangshan Agrochemical & Chemicals Co., Ltd.",600389
426,MINMETALS CAPITAL COMPANY LIMITED,600390
427,"AECC AERO SCIENCE AND TECHNOLOGY CO.,LTD.",600391
428,Shenghe Resources Holding Co. Ltd,600392
429,"Guizhou Panjiang Refined Coal Co.,Ltd.",600395
430,"HUADIAN LIAONING ENERGY DEVELOPMENT CO., LTD",600396
431,"Jiangxi Tungsten Rare And Precious Equipment Co., Ltd.",600397
432,"HLA GROUP CORP.,LTD.",600398
433,"Fushun Special Steel Co.,LTD",600399
434,"Jiangsu Hongdou Industrial Co., Ltd.",600400
435,"HENAN DAYOU ENERGY CO., LTD",600403
436,"Beijing Dynamic Power Co., Ltd",600405
437,"NARI Technology Co., Ltd.",600406
438,"SHANXI ANTAI GROUP CO.,LTD.",600408
439,"Tangshan Sanyou Chemical Industries Co.,Ltd",600409
440,"Beijing Teamsun Technology Co.,Ltd",600410
441,"ZheJiang China Commodities City Group Co.,Ltd.",600415
442,"Xiangtan Electric Manufacturing Co., Ltd.",600416
443,"Anhui Jianghuai Automobile Group Corp.,Ltd",600418
444,"Xinjiang Tianrun Dairy Co., Ltd.",600419
445,"Shanghai Shyndec Pharmaceutical  Co., Ltd.",600420
446,"KPC Pharmaceuticals, Inc.",600422
447,"Liuzhou Chemical Industry Co., LTD",600423
448,"XINJIANG QINGSONG BUILDING MATERIALS AND CHEMICALS (GROUP) CO., LTD.",600425
449,SHANDONG HUALU-HENGSHENG CHEMICAL CO.，LTD,600426
450,"COSCO SHIPPING Specialized Carriers Co., Ltd.",600428
451,"BEIJING SANYUAN FOODS CO.,LTD.",600429
452,"Guangdong Guanhao High-tech Co., Ltd",600433
453,"North Navigation Control Technology Co., Ltd.",600435
454,"ZHANGZHOU PIENTZEHUANG PHARMACEUTICAL CO.,LTD.",600436
455,"TONGWEI CO.,LTD",600438
456,"HENAN REBECCA HAIR PRODUCTS CO., LTD",600439
457,"Sinomach General Machinery Science & Technology Co.,Ltd.",600444
458,"SHENZHEN KINGDOM SCI-TECH CO., LTD",600446
459,"HUAFANG CO.,LTD",600448
460,"NINGXIA BUILDING MATERIALS GROUP Co.,Ltd",600449
461,"CHONGQING FULING ELECTRIC POWER INDUSTRIAL CO.,LTD.",600452
462,"But'one Information Corporation, Xi'an",600455
463,"BAOJI TITANIUM INDUSTRY CO., LTD",600456
464,"ZHUZHOU TIMES NEW MATERIALS TECHNOLOGY CO.,LTD.",600458
465,"SINO-PLATINUM METALS CO.,LTD.",600459
466,"Hangzhou Silan Microelectronics Co.,Ltd.",600460
467,"JIANGXI HONGCHENG ENVIRONMENT CO., LTD.",600461
468,"Beijing Airport High-Tech Park Co.,Ltd.",600463
469,"SHANDONG  HOMEY  AQUATIC  DEVELOPMENT  CO.,LTD.",600467
470,"TIANJIN BENEFO TEJING ELECTRIC CO.,LTD.",600468
471,"AEOLUS TYRE CO.,LTD",600469
472,"Anhui Liuguo Chemical Co.,Ltd.",600470
473,"Wuxi Huaguang Environment & Energy Group Co.,Ltd.",600475
474,"Hunan  Copote  Science&Technology  Co.,Ltd.",600476
475,"HANGXIAO STEEL STRUCTURE CO.,LTD",600477
476,HUNAN  CORUN  NEW  ENERGY  CO.，LTD.,600478
477,"ZhuZhou QianJin Pharmaceutical Co., Ltd.",600479
478,LINGYUN  INDUSTRIAL  CORPORATION  LIMITED,600480
479,"Shuangliang Eco-Energy Systems Co.,Ltd",600481
480,"China Shipbuilding Industry Group Power Co., Ltd.",600482
481,FUJIAN FUNENG CO.，LTD.,600483
482,"Jiangsu Yangnong Chemical Co.,Ltd.",600486
483,"Hengtong Optic-Electric Co.,Ltd.",600487
484,"Tianjin Tianyao Pharmaceutical Co., Ltd.",600488
485,ZHONGJIN GOLD CORPORATION LIMITED,600489
486,"Pengxin International Mining Co.,Ltd",600490
487,"LONG YUAN CONSTRUCTION GUOUP CO.,LTD",600491
488,fujian fynex textile science & technology co.，ltd.,600493
489,JINXI AXLE COMPANY LIMITED,600495
490,"changjiang & jinggong steel building (group) co.,ltd",600496
491,"Yunnan Chihong Zinc&Germanium Co.,Ltd.",600497
492,"Fiberhome Telecommunication Technologies Co.,Ltd.",600498
493,"Keda Industrial Group Co., Ltd.",600499
494,SINOCHEM INTERNATIONAL CORPORATION,600500
495,Aerosun Corporation,600501
496,Anhui Construction Engineering Group Corporation Limited,600502
497,"Deluxe Family Co., Ltd.",600503
498,"Sichuan Xichang Electric Power Co.,Ltd",600505
499,"Tongyi Carbon Neutral Technology (Xinjiang) Co., Ltd.",600506
500,"FANGDA SPECIAL STEEL TECHNOLOGY CO., LTD",600507
501,"SHANGHAI DATUN ENERGY RESOURSES CO.,LTD.",600508
502,"XINJIANG TIANFU ENERGY CO.,LTD",600509
503,"BLACK PEONY (GROUP) CO., LTD.",600510
504,China National Medicines Corporation Ltd.,600511
505,"Tengda Construction Group Co.,Ltd.",600512
506,"Jiangsu Lianhuan Pharmaceutical Co., Ltd.",600513
507,"Hainan Airport Infrastructure Co., Ltd",600515
508,"FangDa Carbon New Material CO.,LTD",600516
509,"State Grid Yingda Co.,ltd.",600517
510,"Kangmei Pharmaceutical Co., Ltd",600518
511,"KWEICHOW MOUTAI CO.,LTD.",600519
512,"HIIG Trinity (Anhui) Technology Co., LTD.",600520
513,"Zhejiang Huahai Pharmaceutical Co.,LTD.",600521
514,"JIANGSU ZHONGTIAN TECHNOLOGY CO.,LTD.",600522
515,"GUIZHOU GUIHANG AOTOMOTIVE COMPONENTS CO., LTD",600523
516,"ZHEJIANG FEIDA ENVIRONMENTAL SCIENCE &TECHNOLOGY CO.,LTD.",600526
517,"Jiangsu Jiangnan High Polymer Fiber CO.,Ltd",600527
518,China Railway Hi-tech Industry Corporation Limited,600528
519,"SHANDONG PHARMACEUTICAL GLASS CO.,LTD",600529
520,"SHANGHAI JIAODA ONLLY CO.,LTD",600530
521,HENAN YUGUANG GOLD&LEAD CO.，LTD,600531
522,"NANJING CHIXIA DEVELOPMENT CO., LTD.",600533
523,"Tasly Pharmaceutical Group CO., LTD.",600535
524,CHINA NATIONAL SOFTWARE & SERVICE COMPANY LIMITED,600536
525,"EGing Photovoltaic Technology Co., Ltd.",600537
526,"Beihai Gofar Chuanshan Biological Co., Ltd.",600538
527,"Lionhead Technology Development Co.,Ltd.",600539
528,"XINJIANG SAYRAM MODERN AGRICULTURE CO.,LTD.",600540
529,"GANSU MOGAO INDUSTRIAL DEVELOPMENT CO.,LTD.",600543
530,"SAURER INTELLIGENT TECHNOLOGY CO., LTD.",600545
531,"Shanxi Coal International Energy Group Co.,LTD",600546
532,"SHANDONG GOLD MINING CO.,LTD.",600547
